,sentences,entity_1_mention,entity_2_mention,type,kfold
147,"in transplant patients, self-medication with st john's wort ( <e1> hypericum perforatum </e1> ) has led to a drop in plasma levels of the immunosupp <e2> cyclosporine </e2>  cyclosporine, causing tissue rejection.",hypericum perforatum,cyclosporine,POSITIVE,2
148,and the pharmacokinetic interaction between  <e1> indomethaci <e2> a. officinarum </e2> . officinarum reduced the systemic exposure of indomethacin and increased its elimination.,indomethacin,a. officinarum,POSITIVE,2
149,"aim of the study: the antithrombotic effect of  <e1> danggui </e1>  and honghua, herbs commonly used in traditional chinese medicine to treat the syndrome corresponding to vascular thrombosis, and their potential inter <e2> clopidogrel </e2> h clopidogrel were investigated. materials and methods: the efficacy of danggui, honghua alone or combination with clopidogrel was determined in three experimental models.",danggui,clopidogrel,SPECULATIVE,2
150,"previous in vitro studies indicate that curcuminoids and  <e1> piperine </e1>  (a black pepper derivative that enhances curcuminoid bioavailability) could inhibit  <e2> cyp2c9 </e2> cyp3a, cyp2c9, ugt and sult dependent drug metabolism.",piperine,cyp2c9,POSITIVE,2
151,coadministration of  <e1> honghu <e2> clopidogrel </e2> d clopidogrel resulted in a 63.5% and 79.7% increase in the auc respectively.,honghua,clopidogrel,POSITIVE,2
152," <e1> khat </e1>  chewing has been shown to reduce the bioavailabilities of orally co-administered antibiotics, ampicillin, amoxicillin, cephradine and tetracyclinehcl, and the antima <e2> chloroquine </e2> , chloroquine.",khat,chloroquine,POSITIVE,2
153,"aim: to investigate the effects of ginkgo biloba extract (gbe) and  <e1> tanshinone </e1>  (tan) on cytochrome p450 (cyp) isozymes and glutathione transferase (gt) in rats. methods: several cyp-dependent reactions were monitored in liver and kidney microsomes of male rats treated ig with gbe and tan daily for 10 d. the activity of gt, the levels of malondialdehyde (mda) and nitric oxide (no) in the tissues were also determined. results: cyp1a1, 1a2, and 2b1 activities in the liver were all significantly increased (2-9.5 fold) by pretreatment <e2> tan </e2> th gbe or tan (p<0.01).",tanshinone,tan,COREF,2
154,"subject sedation and electroencephalograph effects were also measured following midazolam dosing. results: compared with placebo, the curcuminoid/ <e1> piperine </e1>  treatment produced no meaningful changes in plasma c(max), auc, clearance, elimination half-life or metaboli <e2> midazolam </e2>  of midazolam, flurbiprofen or paracetamol (α = 0.05, paired t-tests).",piperine,midazolam,NEGATIVE,2
155,"aim: to investigate the effects of ginkgo biloba extract ( <e1> gbe </e1> ) and tanshinone (tan) on cyto <e2> cyp </e2> ome p450 (cyp) isozymes and glutathione transferase (gt) in rats. methods: several cyp-dependent reactions were monitored in liver and kidney microsomes of male rats treated ig with gbe and tan daily for 10 d. the activity of gt, the levels of malondialdehyde (mda) and nitric oxide (no) in the tissues were also determined. results: cyp1a1, 1a2, and 2b1 activities in the liver were all significantly increased (2-9.5 fold) by pretreatment with gbe or tan (p<0.01).",gbe,cyp,SPECULATIVE,2
156,significant (p < 0.001) improvement was observed in the activities of enzymatic and non-enzymatic antioxidants in patients treated with  <e1> sesame </e1>  oil and its comb <e2> glibenclamide </e2> glibenclamide. conclusions: sesame oil exhibited synergistic effect with glibenclamide and can provide a safe and effective option for the drug combination that may be very useful in clinical practice for the effective improvement of hyperglycemia.,sesame,glibenclamide,POSITIVE,2
157,"however, neither  <e1> echinacea </e1>  nor policosanol significan <e2> warfarin </e2> cted warfarin pharmacodynamics, platelet aggregation or baseline clotting status in healthy subjects.",echinacea,warfarin,NEGATIVE,2
158,"isoxanthohumol from hops was the most potent inhibitor of cyp2c8 with an ic50 of 0.2 μm, whereas  <e1> 8-prenylnaringenin </e1>  was the most potent  <e2> cyp1a2 </e2> tor of cyp1a2, cyp2c9 and cyp2c19 with ic50 values of 1.1 μm, 1.1 μm and 0.4 μm, respectively.",8-prenylnaringenin,cyp1a2,POSITIVE,2
159,"), was given to the rabbits and the blood samples were withdrawn at different time intervals (0, 0.5, 1, 1.5, 2, 3, 4, 6, 8, 12, 24 and 36 h) from marginal ear vein after dosing and theophylline in plasma was analyzed by hplc method. results: it was observed that there a significant differences in the cmax, auc, aumc, t1/2, and mrt of  <e1> theophylline </e1>  when coadmin <e2> commiphora myrrha </e2> iphora myrrha which indicate that the herb affect the metabolism and elimination when coadministered with theophylline . conclusion: our results suggested that concurrent use of investigated herb alters the pharmacokinetics of theophylline.",theophylline,commiphora myrrha,POSITIVE,2
160,"radix bupleuri and  <e1> vinegar-baked radix bupleuri </e1>  have strong induction effects on <e2> cyp2d6 </e2> yp2e1, cyp2d6 and cyp3a4, however, have no impact on cyp1a2.",vinegar-baked radix bupleuri,cyp2d6,POSITIVE,2
161,"previous in vitro studies indicate that  <e1> curcuminoids </e1>  and piperine (a black pepper derivative that enhances curcuminoid bioavailability) could inhibit  <e2> cyp2c9 </e2> cyp3a, cyp2c9, ugt and sult dependent drug metabolism.",curcuminoids,cyp2c9,POSITIVE,2
162,"interactions of several commonly used herbal medicines, such as ginko biloba, milk thistle, and  <e1> st. john's wort </e1> , with therapeutic drugs including warfarin, midazolam, alprazolam <e2> saquinavir </e2> r, saquinavir, digoxin, nifedipine, cyclosporine, tacrolimus, irinotecan, and imatinib in humans have been reported.",st. john's wort,saquinavir,POSITIVE,2
163,"aims: herbal products, spices and/or fruits are perceived as inherently healthy; for instance, st. john's wort ( <e1> sjw </e1> ) is marketed as a natural antidepressant and patients often self-administer it concom <e2> oncology medications </e2> y medications.",sjw,oncology medications,SPECULATIVE,2
164,"moreover, ligustilide, schisantherin a,  <e1> berberine </e1>  hydrochloride and trans-resveratrol were identified for the first time as efficacious pxr agonists. conclusions: twenty-two tcm ethanol extracts and eight bioactive compounds could activate pxr signalling pathwa <e2> cyp3a4 </e2> induce cyp3a4 reporter gene.",berberine,cyp3a4,POSITIVE,2
165,and the pharmacokinetic interaction between indomethacin and  <e1> a. officinarum </e1>  reduced the systemic <e2> indomethacin </e2>  indomethacin and increased its elimination.,a. officinarum,indomethacin,POSITIVE,2
166,dosing with ginkgo or  <e1> ginger </e1>  was continued for 7 days after administr <e2> warfarin </e2>  the warfarin dose.,ginger,warfarin,SPECULATIVE,2
167,"however, both  <e1> danggui </e1>  and honghua significantly potentiated the prolongati <e2> clopidogrel </e2> y clopidogrel on the tail bleeding time and pt. conclusions: danggui and honghua possess antithrombotic activity and cannot potentiate the antithrombotic effect of clopidogrel.",danggui,clopidogrel,POSITIVE,2
168,"other herbal remedies with the potential to modulate  <e2> cytochrome p450 </e2>  activity and thus participate in interactions with conventional drugs include milk thistle, angelica dahurica, ginseng, garlic preparations, danshen and  <e1> liquorice </e1> .",liquorice,cytochrome p450,POSITIVE,2
169,"moreover, ligustilide,  <e1> schisantherin a </e1> , berberine hydrochloride and trans-resveratrol were identified for the first time as efficacious pxr agonists. conclusions: twenty-two tcm ethanol extracts and eight bioactive compounds could activate pxr signalling pathwa <e2> cyp3a4 </e2> induce cyp3a4 reporter gene.",schisantherin a,cyp3a4,POSITIVE,2
170,"herbal medicine regimens containing radix bupleuri, fructus gardenia, fructus schisandrae, radix rehmanniae, akebia caulis, and  <e1> semen plantaginis </e1>  in concomitant use with <e2> clozapine </e2> ne, clozapine, and olanzepine were associated with nearly 60% of the risk of adverse outcomes. conclusions : concomitant herbal and antipsychotic treatment could produce either beneficial or adverse clinical effects in schizophrenic population.",semen plantaginis,clozapine,POSITIVE,2
171,readministration of  <e1> felodipine <e2> grapefruit </e2> th grapefruit juice produced mean felodipine auc (61.5 +/- 32.2 ng ml-1 h) and cmax (8.4 +/- 4.8 ng ml-1) which were similar to the initial grapefruit juice treatment 1-3 weeks previously.,felodipine,grapefruit,NEGATIVE,2
172,"herbal medicine regimens containing  <e1> radix bupleuri </e1> , fructus gardenia, fructus schisandrae, radix rehmanniae, akebia caulis, and semen plantaginis in concomit <e2> quetiapine </e2> th quetiapine, clozapine, and olanzepine were associated with nearly 60% of the risk of adverse outcomes. conclusions : concomitant herbal and antipsychotic treatment could produce either beneficial or adverse clinical effects in schizophrenic population.",radix bupleuri,quetiapine,POSITIVE,2
173,"in this study, the pk parameters of  <e1> atenolol </e1>  responded in a dose-depende <e2> apple </e2> nner to apple juice. conclusions: apple juice markedly reduced systemic exposure to atenolol.",atenolol,apple,SPECULATIVE,2
174,"isoxanthohumol from hops was the most potent inhibitor of cyp2c8 with an ic50 of 0.2 μm, whereas  <e1> 8-prenylnaringenin </e1>  was the most potent inhibito <e2> cyp2c9 </e2> yp1a2, cyp2c9 and cyp2c19 with ic50 values of 1.1 μm, 1.1 μm and 0.4 μm, respectively.",8-prenylnaringenin,cyp2c9,POSITIVE,2
175,"previous in vitro studies indicate that  <e1> curcuminoids </e1>  and piperine (a black pepper derivative that enhances curcuminoid bioavailability) could inhibit human cyp3a, cyp <e2> sult </e2>  ugt and sult dependent drug metabolism.",curcuminoids,sult,POSITIVE,2
176,synergistic effects (ci < 1) for  <e1> p. emblica </e1> /do <e2> cisplatin </e2>  or cisplatin at different dose levels were demonstrated in a549 and hepg2 cells.,p. emblica,cisplatin,POSITIVE,2
177," <e1> radix bupleuri </e1>  and vinegar-baked radix bupleuri have strong induction ef <e2> cyp2e1 </e2> on the cyp2e1, cyp2d6 and cyp3a4, however, have no impact on cyp1a2.",radix bupleuri,cyp2e1,POSITIVE,2
178,"moreover, ligustilide, schisantherin a, berberine  <e1> hydrochloride </e1>  and trans-resveratrol were identified for the first time as efficacious pxr agonists. conclusions: twenty-two tcm ethanol extracts and eight bioactive compounds could activate pxr signalling pathwa <e2> cyp3a4 </e2> induce cyp3a4 reporter gene.",hydrochloride,cyp3a4,POSITIVE,2
179,"interactions of several commonly used herbal medicines, such as ginko biloba,  <e1> milk thistle </e1> , and st. john's wort, with therapeutic drugs including warfarin, midazolam, alprazolam, indinavir, saquinavir, digoxin, nifedipine, cyclosporine, <e2> irinotecan </e2> s, irinotecan, and imatinib in humans have been reported.",milk thistle,irinotecan,POSITIVE,2
180,"in order to investigate the influence of  <e1> rhodiola rosea l. </e1>  roots on mood disorders, three extracts were tested against monoami <e2> maos a and b </e2> (maos a and b) in a microtitre plate bioassay. materials and methods: methanol and water extracts gave the highest inhibitory activity against maos.",rhodiola rosea l.,maos a and b,POSITIVE,2
181,patients detected with hiv or cancer often consume herbal products especially st. john's wort ( <e1> sjw </e1> ) for antidepressants in comb <e2> prescription medicines </e2> ion medicines.,sjw,prescription medicines,SPECULATIVE,2
182,"interactions of several commonly used herbal medicines, such as ginko biloba,  <e1> milk thistle </e1> , and st. john's wort, with therapeutic drugs including warfarin, midazolam, alprazolam, indinavir, saquinavir, digoxin, nifedipine, cyclosporine, tacrolimus, iri <e2> imatinib </e2>  and imatinib in humans have been reported.",milk thistle,imatinib,POSITIVE,2
183, <e1> felodipine </e1>  10 mg extended release was administered with 250 ml regu <e2> grapefruit </e2> th grapefruit juice or water in a randomized crossover manner followed by a second grapefruit juice treatment in 12 healthy men.,felodipine,grapefruit,SPECULATIVE,2
184,"aim: to investigate the effects of ginkgo biloba extract (gbe) and tanshinone (tan) on cytochrome p450 (cyp) isozymes and glutathione transferase (gt) in rats. methods: several cyp-dependent reactions were monitored in liver and kidney microsomes of male rats treated ig with gbe and tan daily for 10 d. the activity of gt, the levels of malondialdehyde (mda) and nitric oxide (no) in the tissues were also determined. results: cyp1a1,  <e1> 1a2 </e1> , and 2b1 activities in the liver were all significantly increased (2-9.5 fold) by pretreatment <e2> tan </e2> th gbe or tan (p<0.01).",1a2,tan,POSITIVE,2
185,"12 h-fasting venous blood samples were collected at baseline (0 day) and after 60 days of the experiment for various biochemical analysis. results: as compared with sesame oil and glibenclamide alone, combination therapy showed an improved anti-hyperglycemic effect with 36% reduction of glucose (p < 0.001 vs before treatment, p < 0.01 vs  <e1> sesame </e1>  oil monotherapy, <e2> glibenclamide </e2> glibenclamide monotherapy) and 43% reduction of hba(1c) (p < 0.001 vs before treatment, p < 0.01 vs sesame oil monotherapy, p < 0.05 vs glibenclamide monotherapy) at the end point.",sesame,glibenclamide,POSITIVE,2
186,"isoxanthohumol from  <e1> hops </e1>  was the most potent  <e2> cyp2c8 </e2> tor of cyp2c8 with an ic50 of 0.2 μm, whereas 8-prenylnaringenin was the most potent inhibitor of cyp1a2, cyp2c9 and cyp2c19 with ic50 values of 1.1 μm, 1.1 μm and 0.4 μm, respectively.",hops,cyp2c8,POSITIVE,2
187,"prospective simulations with  <e1> grapefruit </e1>  juice and turmeric showed clinically minor to insignificant changes in exposure (<1 <e2> acalabrutinib </e2> acalabrutinib, osimertinib and olaparib, but predicted 1.57-fold fc-di risk between acalabrutinib and curcumin.",grapefruit,acalabrutinib,POSITIVE,2
188,"as hops (humulus lupulus l.) are used in the brewing of beer and by menopausal women as estrogenic dietary supplements, the potential for hop extracts and  <e1> hop </e1>  constitue <e2> drug </e2> to cause drug-botanical interactions by inhibiting human cytochrome p450 enzymes was investigated.",hop,drug,POSITIVE,2
189,"aim: to investigate the effects of ginkgo biloba extract ( <e1> gbe </e1> ) and tanshin <e2> cytochrome p450 </e2> tochrome p450 (cyp) isozymes and glutathione transferase (gt) in rats. methods: several cyp-dependent reactions were monitored in liver and kidney microsomes of male rats treated ig with gbe and tan daily for 10 d. the activity of gt, the levels of malondialdehyde (mda) and nitric oxide (no) in the tissues were also determined. results: cyp1a1, 1a2, and 2b1 activities in the liver were all significantly increased (2-9.5 fold) by pretreatment with gbe or tan (p<0.01).",gbe,cytochrome p450,SPECULATIVE,2
190,"in this study, we investigated the effects of  <e1> a. paniculata </e1>  extract (ape) and andrographolide on the expression of drug-metabolizing enzymes in rat liver and determined whether modulation of these enzymes changed the pharmac <e2> tolbutamide </e2> f tolbutamide.",a. paniculata,tolbutamide,SPECULATIVE,2
191,"however, both danggui and  <e1> honghua </e1>  significantly potentiated the prolongati <e2> clopidogrel </e2> y clopidogrel on the tail bleeding time and pt. conclusions: danggui and honghua possess antithrombotic activity and cannot potentiate the antithrombotic effect of clopidogrel.",honghua,clopidogrel,POSITIVE,2
192,"aim: to assess the effects of radix bupleuri and  <e1> vinegar-baked radix bupleu <e2> cytochrome 450 </e2> ytochrome 450 activity of rats. methods: six probe drugs (caffeine, midazolam, dextromethorphan, tolbutamide, omeprazole, chlorzoxazone) were simultaneously given to rats after different dosing of radix bupleuri or vinegar-baked radix bupleuri for seven days.",vinegar-baked radix bupleuri,cytochrome 450,SPECULATIVE,2
193,"aim: to examine the growth inhibitory effects of  <e1> phyllanthus emblica </e1>  (p. emblica) and terminalia bellerica (t. bellerica) extracts on human hepatocellular carcinoma (hepg2), and lung carcinoma (a549) cells and their synergistic <e2> doxorubicin </e2> h doxorubicin or cisplatin. methods: hepg2 and a549 cells were treated with p. emblica and t. bellerica extracts either alone or in combination with doxorubicin or cisplatin and effects on cell growth were determined using the sulforhodamine b (srb) assay.",phyllanthus emblica,doxorubicin,SPECULATIVE,2
194,"for example,  <e1> st. john's wort </e1>  is a poten <e2> cyp3a4 </e2> cer of cyp3a4, which is mediated by activating the orphan pregnane x receptor.",st. john's wort,cyp3a4,POSITIVE,2
195,"so far,  <e1> st. john's wort </e1>  has been tested only with the protease inhibitor indinavir (crixivan), but it is likely to affect other drugs in that class  <e2> non-nucleoside reverse transcriptase inhibitors </e2> se inhibitors.",st. john's wort,non-nucleoside reverse transcriptase inhibitors,POSITIVE,2
196,dosing with  <e1> ginkgo </e1>  or ginger was continued for 7 days after administr <e2> warfarin </e2>  the warfarin dose.,ginkgo,warfarin,SPECULATIVE,2
197,"for example, induction of cyp3a4 by  <e1> st. john's wort </e1>  may partly provide an explanation for the enhanced plasma clearance of a number of drugs, such as cycl <e2> innadivir </e2> and innadivir, which are known substrates of cyp3a4, although other mechanisms including modulation of gastric absorption and drug transporters cannot be ruled out.",st. john's wort,innadivir,POSITIVE,2
198," <e1> radix bupleuri </e1>  and vinegar-baked radix bupleuri have strong induction effects on <e2> cyp2d6 </e2> yp2e1, cyp2d6 and cyp3a4, however, have no impact on cyp1a2.",radix bupleuri,cyp2d6,POSITIVE,2
199,"aim: to investigate the effects of ginkgo biloba extract (gbe) and tanshinone (tan) on cytochrome p450 (cyp) isozymes and glutathione transferase (gt) in rats. methods: several cyp-dependent reactions were monitored in liver and kidney microsomes of male rats treated ig with gbe and tan daily for 10 d. the activity of gt, the levels of malondialdehyde (mda) and nitric oxide (no) in the tissues were also determined. results: cyp1a1,  <e1> 1a2 </e1> , and 2b1 activities in the liver were all significantly increased (2-9.5 fold) by pretr <e2> gbe </e2> ment with gbe or tan (p<0.01).",1a2,gbe,POSITIVE,2
200,"the aim was to evaluate antibiotic modulatory effect of crude extracts from agrimonia eupatoria, hypericum alpestre, rumex obtusifolius and  <e1> sanguisorba officinalis </e1>  herbs tow <e2> commercial antibiotics </e2> l antibiotics using some gram-positive and gram-negative bacteria. methods: the antibiotic modulatory activity was tested by determining mics of antibiotics in the absence and presence of plant crude extracts at subinhibitory concentrations.",sanguisorba officinalis,commercial antibiotics,POSITIVE,2
201,"aim: to assess the effects of radix bupleuri and vinegar-baked radix bupleuri on cytochrome 450 activity of rats. methods: six probe drugs (caffeine, midazolam, dextromethorphan,  <e1> tolbutamide </e1> , omeprazole, chlorzoxazone) were simultaneously given to rats after different dosing of radix <e2> vinegar-baked radix bupleuri </e2> adix bupleuri for seven days.",tolbutamide,vinegar-baked radix bupleuri,SPECULATIVE,2
202,streptozotocin-nicotinamide-induced diabetic and normal rats were gavaged by  <e1> cinnamon < <e2> metformin </e2> /or metformin for 14 days.,cinnamon,metformin,POSITIVE,2
203,"the dosage schedules were 120 mg  <e1> g. biloba </e1> , 240 mg g. bi <e2> cilostazol </e2> mg cilostazol, 200 mg cilostazol, 75 mg clopidogrel, 150 mg clopidogrel, 120 mg g. biloba+ 100 mg cilostazol and 120 mg g. biloba+ 75 mg clopidogrel.",g. biloba,cilostazol,SPECULATIVE,2
204,"anticoagulants, nsaids, anti-platelet agents:  <e1> lavender </e1>  contains varying amounts of coumarins and may therefore theoretically increase t <e2> anticoagulant medications </e2> t medications.",lavender,anticoagulant medications,POSITIVE,2
205," <e1> alpinia officinarum </e1>  hance of the chinese traditional herb for the treatment of emesis, abdominal pain and diarrhea has been used to counteract gastric diseas <e2> indomethacin </e2>  indomethacin in rats without obvious side effects.",alpinia officinarum,indomethacin,SPECULATIVE,2
206,"serum pools prepared from samples from patients receiving  <e1> digoxin </e1>  and then supplemented w <e2> siberian ginseng </e2> erian ginseng showed falsely increased digoxin values using the fpia (e.g., for asian ginseng, 1.54 ng/ml [2.0 nmol/l] vs control value, 1.10 ng/ml [1.4 nmol/l]) and falsely decreased values using the microparticle enzyme immunoassay (meia; 0.73 ng/ml [0.9 nmol/l] vs control value, 1.04 ng/ml [1.3 nmol/l]).",digoxin,siberian ginseng,POSITIVE,2
207,"aim: to investigate the effects of ginkgo biloba extract (gbe) and tanshinone (tan) on cytochrome p450 (cyp) isozymes and glutathione transferase (gt) in rats. methods: several cyp-dependent reactions were monitored in liver and kidney microsomes of male rats treated ig with gbe and tan daily for 10 d. the activity of gt, the levels of malondialdehyde (mda) and nitric oxide (no) in the tissues were also determined. results: cyp1a1, 1a2, and  <e1> 2b1 </e1>  activities in the liver were all significantly increased (2-9.5 fold) by pretreatment <e2> tan </e2> th gbe or tan (p<0.01).",2b1,tan,POSITIVE,2
208,"aim: to assess the effects of radix bupleuri and vinegar-baked radix bupleuri on cytochrome 450 activity of rats. methods: six probe drugs (caffeine, midazolam,  <e1> dextromethorphan </e1> , tolbutamide, omeprazole, chlorzoxazone) were simultaneously given to rats after differe <e2> radix bupleuri </e2> adix bupleuri or vinegar-baked radix bupleuri for seven days.",dextromethorphan,radix bupleuri,SPECULATIVE,2
209,"serum pools prepared from samples from patients receiving digoxin and then supplemented with asian or  <e1> siberian ginseng </e1>  showed false <e2> digoxin </e2> eased digoxin values using the fpia (e.g., for asian ginseng, 1.54 ng/ml [2.0 nmol/l] vs control value, 1.10 ng/ml [1.4 nmol/l]) and falsely decreased values using the microparticle enzyme immunoassay (meia; 0.73 ng/ml [0.9 nmol/l] vs control value, 1.04 ng/ml [1.3 nmol/l]).",siberian ginseng,digoxin,POSITIVE,3
210,"herbal medicine regimens containing radix bupleuri,  <e1> fructus gardenia </e1> , fructus schisandrae, radix rehmanniae, akebia caulis, and semen plantaginis in concomit <e2> quetiapine </e2> th quetiapine, clozapine, and olanzepine were associated with nearly 60% of the risk of adverse outcomes. conclusions : concomitant herbal and antipsychotic treatment could produce either beneficial or adverse clinical effects in schizophrenic population.",fructus gardenia,quetiapine,POSITIVE,3
211,"subject sedation and electroencephalograph effects were also measured following midazolam dosing. results: compared with placebo, the  <e1> curcuminoid </e1> /piperine treatment produced no meaningful changes in plasma c(max), auc, clearance, elimination half-life or metabolite levels of midazolam, flu <e2> paracetamol </e2> r paracetamol (α = 0.05, paired t-tests).",curcuminoid,paracetamol,NEGATIVE,3
212,"it is unclear whether some component of the  <e1> ginseng </e1>  was  <e2> digoxin </e2> ed to digoxin in vivo, interfered with digoxin elimination or caused a false serum assay result.",ginseng,digoxin,SPECULATIVE,3
213,"interactions of several commonly used herbal medicines, such as ginko biloba,  <e1> milk thistle </e1> , and st. john's wort, with therapeutic dru <e2> warfarin </e2> ding warfarin, midazolam, alprazolam, indinavir, saquinavir, digoxin, nifedipine, cyclosporine, tacrolimus, irinotecan, and imatinib in humans have been reported.",milk thistle,warfarin,POSITIVE,3
214,"aim: to examine the growth inhibitory effects of phyllanthus emblica (p. emblica) and  <e1> terminalia bellerica </e1>  (t. bellerica) extracts on human hepatocellular carcinoma (hepg2), and lung carcinoma (a549) cells and their synergistic <e2> doxorubicin </e2> h doxorubicin or cisplatin. methods: hepg2 and a549 cells were treated with p. emblica and t. bellerica extracts either alone or in combination with doxorubicin or cisplatin and effects on cell growth were determined using the sulforhodamine b (srb) assay.",terminalia bellerica,doxorubicin,SPECULATIVE,3
215,"), was given to the rabbits and the blood samples were withdrawn at different time intervals (0, 0.5, 1, 1.5, 2, 3, 4, 6, 8, 12, 24 and 36 h) from marginal ear vein after dosing and theophylline in plasma was analyzed by hplc method. results: it was observed that there a significant differences in the cmax, auc, aumc, t1/2, and mrt of theophylline when coadministered with  <e2> commiphora myrrha </e2>  which indicate that the herb affect the metabolism and elimination when coadministered with theophylline . conclusion: our results suggested that concurrent use of investigated  <e1> herb </e1>  alters the pharmacokinetics of theophylline.",herb,commiphora myrrha,COREF,3
216,"interactions of several commonly used herbal medicines, such as  <e1> ginko biloba </e1> , milk thistle, and st. john's wort, with therapeutic drugs including warfarin <e2> alprazolam </e2> m, alprazolam, indinavir, saquinavir, digoxin, nifedipine, cyclosporine, tacrolimus, irinotecan, and imatinib in humans have been reported.",ginko biloba,alprazolam,POSITIVE,3
